{
  "schemaVersion": 1,
  "status": "draft",
  "notes": [
    "Transcribed from Find_Your_Class_Pilot_Blueprint_v1.md sections 5.1-5.4 (criterion set) and section 6 (anchor examples for crowd-control, personal-durability, social-influence, resource-endurance).",
    "status:\"needs-anchors\" / \"needs-values\" criteria are transcribed labels only -- their 1/3/5/7/10 anchors or closed value lists are Codex's editorial work per Find_Your_Class_Product_Architecture_v1.md section 18, not yet authored. Do not use these criteria for scoring until anchors/values are reviewed.",
    "20 criteria (13 capability + 7 directional, categoryId \"audit-capability\"/\"audit-directional\") added from Find_Your_Class_Criteria_Audit_and_Compass_Calibration_v1.md section 3, growing the catalogue from 44 to 64 per that document's section 1. companion-centrality (formerly none-central-companion) and build-fragility (formerly build-forgiveness) were renamed per section 2, each keeping the old id as an \"aliases\" entry since question-templates.json and the pilot fixtures already shipped under the old id."
  ],
  "criteria": [
    {
      "id": "melee-ranged",
      "categoryId": "pilot-directional",
      "kind": "directional",
      "playerLabel": "Where do you want to fight?",
      "shortLabel": "Where do you want to fight?",
      "lowAnchor": {
        "value": 1,
        "label": "In the thick of melee"
      },
      "midAnchor": {
        "value": 5.5,
        "label": "Flexible / no strong lean"
      },
      "highAnchor": {
        "value": 10,
        "label": "Fighting from range"
      },
      "allowNotRelevant": true,
      "allowHardConstraint": false,
      "anchors": null,
      "status": "needs-anchors",
      "schemaVersion": 1
    },
    {
      "id": "martial-magic",
      "categoryId": "pilot-directional",
      "kind": "directional",
      "playerLabel": "What should drive the character?",
      "shortLabel": "What should drive the character?",
      "lowAnchor": {
        "value": 1,
        "label": "Weapon/physical mastery"
      },
      "midAnchor": {
        "value": 5.5,
        "label": "Flexible / no strong lean"
      },
      "highAnchor": {
        "value": 10,
        "label": "Magic is the main answer"
      },
      "allowNotRelevant": true,
      "allowHardConstraint": false,
      "anchors": null,
      "status": "needs-anchors",
      "schemaVersion": 1
    },
    {
      "id": "specialist-versatile",
      "categoryId": "pilot-directional",
      "kind": "directional",
      "playerLabel": "Would you rather specialise or keep many options open?",
      "shortLabel": "Would you rather specialise or keep many options open?",
      "lowAnchor": {
        "value": 1,
        "label": "Focused specialist"
      },
      "midAnchor": {
        "value": 5.5,
        "label": "Flexible / no strong lean"
      },
      "highAnchor": {
        "value": 10,
        "label": "Broad problem solver"
      },
      "allowNotRelevant": true,
      "allowHardConstraint": false,
      "anchors": null,
      "status": "needs-anchors",
      "schemaVersion": 1
    },
    {
      "id": "routine-tactical",
      "categoryId": "pilot-directional",
      "kind": "directional",
      "playerLabel": "What kind of turns do you enjoy?",
      "shortLabel": "What kind of turns do you enjoy?",
      "lowAnchor": {
        "value": 1,
        "label": "Reliable, repeatable routine"
      },
      "midAnchor": {
        "value": 5.5,
        "label": "Flexible / no strong lean"
      },
      "highAnchor": {
        "value": 10,
        "label": "Many situational choices"
      },
      "allowNotRelevant": true,
      "allowHardConstraint": false,
      "anchors": null,
      "status": "needs-anchors",
      "schemaVersion": 1
    },
    {
      "id": "independent-teamwork",
      "categoryId": "pilot-directional",
      "kind": "directional",
      "playerLabel": "How should the character succeed?",
      "shortLabel": "How should the character succeed?",
      "lowAnchor": {
        "value": 1,
        "label": "Self-contained"
      },
      "midAnchor": {
        "value": 5.5,
        "label": "Flexible / no strong lean"
      },
      "highAnchor": {
        "value": 10,
        "label": "Built around ally coordination"
      },
      "allowNotRelevant": true,
      "allowHardConstraint": false,
      "anchors": null,
      "status": "needs-anchors",
      "schemaVersion": 1
    },
    {
      "id": "companion-centrality",
      "categoryId": "pilot-directional",
      "kind": "directional",
      "playerLabel": "How involved should a companion be?",
      "shortLabel": "How involved should a companion be?",
      "lowAnchor": {
        "value": 1,
        "label": "No companion"
      },
      "midAnchor": {
        "value": 5.5,
        "label": "Flexible / no strong lean"
      },
      "highAnchor": {
        "value": 10,
        "label": "Companion is central"
      },
      "allowNotRelevant": true,
      "allowHardConstraint": false,
      "anchors": null,
      "status": "needs-anchors",
      "schemaVersion": 1,
      "aliases": [
        "none-central-companion"
      ],
      "notes": [
        "Renamed from none-central-companion per Find_Your_Class_Criteria_Audit_and_Compass_Calibration_v1.md section 2 (\"Rename none-central-companion to companion-centrality in the player model if migration is still cheap. Keep a compatibility alias if the ID has already shipped.\"). The alias is kept since question-templates.json and the pilot fixtures already shipped under the old id."
      ]
    },
    {
      "id": "no-heavy-preparation",
      "categoryId": "pilot-directional",
      "kind": "directional",
      "playerLabel": "How much preparation do you enjoy?",
      "shortLabel": "How much preparation do you enjoy?",
      "lowAnchor": {
        "value": 1,
        "label": "Little or no daily preparation"
      },
      "midAnchor": {
        "value": 5.5,
        "label": "Flexible / no strong lean"
      },
      "highAnchor": {
        "value": 10,
        "label": "Detailed daily preparation"
      },
      "allowNotRelevant": true,
      "allowHardConstraint": false,
      "anchors": null,
      "status": "needs-anchors",
      "schemaVersion": 1
    },
    {
      "id": "steady-burst",
      "categoryId": "pilot-directional",
      "kind": "directional",
      "playerLabel": "How should power feel?",
      "shortLabel": "How should power feel?",
      "lowAnchor": {
        "value": 1,
        "label": "Steady across the day"
      },
      "midAnchor": {
        "value": 5.5,
        "label": "Flexible / no strong lean"
      },
      "highAnchor": {
        "value": 10,
        "label": "Strong limited bursts"
      },
      "allowNotRelevant": true,
      "allowHardConstraint": false,
      "anchors": null,
      "status": "needs-anchors",
      "schemaVersion": 1
    },
    {
      "id": "safe-risky",
      "categoryId": "pilot-directional",
      "kind": "directional",
      "playerLabel": "How much tactical risk do you enjoy?",
      "shortLabel": "How much tactical risk do you enjoy?",
      "lowAnchor": {
        "value": 1,
        "label": "Forgiving and safe"
      },
      "midAnchor": {
        "value": 5.5,
        "label": "Flexible / no strong lean"
      },
      "highAnchor": {
        "value": 10,
        "label": "High-risk/high-reward"
      },
      "allowNotRelevant": true,
      "allowHardConstraint": false,
      "anchors": null,
      "status": "needs-anchors",
      "schemaVersion": 1
    },
    {
      "id": "subtle-overt",
      "categoryId": "pilot-directional",
      "kind": "directional",
      "playerLabel": "How should your power appear?",
      "shortLabel": "How should your power appear?",
      "lowAnchor": {
        "value": 1,
        "label": "Subtle, social or indirect"
      },
      "midAnchor": {
        "value": 5.5,
        "label": "Flexible / no strong lean"
      },
      "highAnchor": {
        "value": 10,
        "label": "Obvious battlefield impact"
      },
      "allowNotRelevant": true,
      "allowHardConstraint": false,
      "anchors": null,
      "status": "needs-anchors",
      "schemaVersion": 1
    },
    {
      "id": "single-target-damage",
      "categoryId": "pilot-capability",
      "kind": "capability",
      "playerLabel": "Bringing down one dangerous enemy",
      "shortLabel": "Bringing down one dangerous enemy",
      "helpText": "Reliable contribution against a priority target",
      "lowAnchor": {
        "value": 1,
        "label": null
      },
      "highAnchor": {
        "value": 10,
        "label": null
      },
      "allowNotRelevant": true,
      "allowHardConstraint": false,
      "anchors": null,
      "status": "needs-anchors",
      "schemaVersion": 1
    },
    {
      "id": "area-damage",
      "categoryId": "pilot-capability",
      "kind": "capability",
      "playerLabel": "Damaging groups of enemies",
      "shortLabel": "Damaging groups of enemies",
      "helpText": "Meaningful multi-target damage access",
      "lowAnchor": {
        "value": 1,
        "label": null
      },
      "highAnchor": {
        "value": 10,
        "label": null
      },
      "allowNotRelevant": true,
      "allowHardConstraint": false,
      "anchors": null,
      "status": "needs-anchors",
      "schemaVersion": 1
    },
    {
      "id": "crowd-control",
      "categoryId": "pilot-capability",
      "kind": "capability",
      "playerLabel": "Controlling the battlefield",
      "shortLabel": "Controlling the battlefield",
      "helpText": "Preventing or limiting enemy actions/positioning",
      "lowAnchor": {
        "value": 1,
        "label": "no meaningful control beyond ordinary attacks."
      },
      "highAnchor": {
        "value": 10,
        "label": "exceptional breadth, progression and encounter-shaping potential."
      },
      "allowNotRelevant": true,
      "allowHardConstraint": false,